{
  "id": "ex.split_bar",
  "role": "section",
  "content": {
    "type": "container",
    "value": {
      "children": [
        {
          "id": "ex.split_bar.title",
          "role": "h2",
          "content": { "type": "text", "value": "Left title" }
        },
        {
          "id": "ex.split_bar.logo",
          "role": "image",
          "content": {
            "type": "image",
            "value": {
              "src": "assets/images/dot.png",
              "width": 24000,
              "height": 24000
            }
          }
        }
      ]
    }
  },
  "layout": {
    "type": "grid",
    "columns": [{ "fr": 1 }, { "auto": true }],
    "column_gap": 12000,
    "cell_align": { "x": "stretch", "y": "center" }
  }
}
