{
  "id": "root",
  "role": "document",
  "content": {
    "type": "container",
    "value": {
      "children": [
        { "include": "content/ex_heading.json" },
        { "include": "content/ex_stack.json" },
        { "include": "content/ex_split_bar.json" },
        { "include": "content/ex_media_row.json" },
        { "include": "content/ex_end_block.json" },
        { "include": "content/ex_grid.json" },
        { "include": "content/ex_poster_shell.json" },
        { "include": "content/ex_banner_header.json" },
        { "include": "content/ex_poster_growers.json" },
        { "include": "content/ex_card_bands.json" },
        { "include": "content/ex_filled_page.json" },
        { "include": "content/ex_cover.json" },
        { "include": "content/ex_overlay.json" },
        { "include": "content/ex_glass.json" },
        { "include": "content/ex_columns.json" },
        { "include": "content/ex_table.json" },
        { "include": "content/ex_table_dense.json" },
        { "include": "content/ex_table_edges.json" },
        { "include": "content/ex_table_colspan.json" },
        { "include": "content/ex_table_composite.json" },
        { "include": "content/ex_on_dark.json" },
        { "include": "content/ex_badge.json" },
        { "include": "content/ex_rule.json" },
        { "include": "content/ex_list.json" },
        { "include": "content/ex_modifiers.json" },
        { "include": "content/ex_code.json" },
        { "include": "content/ex_math.json" },
        { "include": "content/ex_math_numbered.json" },
        { "include": "content/ex_image.json" },
        { "include": "content/ex_form.json" }
      ]
    }
  },
  "layout": {
    "type": "stack",
    "direction": "vertical",
    "gap": 16000
  }
}
